{
  "schemaVersion": "cat.v1",
  "valid": true,
  "issues": [],
  "publicProfile": {"id": "awgtwo-fixture", "name": "Example AWG2", "protocol": "AWG2", "parameters": {"interface.MTU": "1280", "peer[0].Endpoint": "vpn.example.com:51820"}, "capabilityRequirements": ["awg2"], "validationSummary": {"valid": true, "issueCodes": []}, "createdAt": "2026-08-08T10:00:00Z", "updatedAt": "2026-08-08T10:00:00Z"},
  "capabilitySatisfied": true
}
